citation,auteur,
La vie c'est le passage. Dire qu'elle est passage revient à dire qu'elle est action.,Gaston Berger,
"La vie civile ne roule pas sur un seul avis, ni sur un seul usage.",Baltasar Gracian,
La vie d'un homme n'est qu'une lutte pour l'existence avec la certitude d'être vaincu.,Arthur Schopenhauer,
"La vie de l'homme dépend de sa volonté ; sans volonté, elle serait abandonnée au hasard.",Confucius,
La vie de l'homme n'est qu'une succession d'espoirs vains et de peurs sans fondement.,Montesquieu,
La vie des morts consiste à survivre dans l'esprit des vivants.,Cicéron,
"La vie doit être vécue en regardant vers l'avenir, mais elle ne peut être comprise qu'en se retournant vers le passé.",Soren Kierkegaard,
La vie enseigne à faire semblant de n'être qu'un homme.,Paul Valéry,
La vie est à peine un peu plus vieille que la mort.,Paul Valéry,
La vie est belle parce que nous mourons.,Jean D'Ormesson,
"La vie est belle parce que nous mourons. Ce n'est pas un paradoxe. Ce serait atroce si nous ne mourrions pas. Et quand le Christ veut punir le Juif errant, il le condamne à l'immortalité. La vie est belle parce que nous mourons. je le crois profondément.",Jean D'Ormesson,
"La vie est courte, mais elle nous laisse toujours du temps pour la courtoisie.",Ralph Waldo Emerson,
La vie est l'adaptation continue de relations internes à des relations externes.,Herbert Spencer,
La vie est le roman de la matière.,Emil Cioran,
"La vie est perdue contre la mort, mais la mémoire gagne dans son combat contre le néant.",Tzvetan Todorov,
"La vie est pièce de théâtre : ce qui compte, ce n'est pas qu'elle dure longtemps, mais qu'elle soit bien jouée.",Sénèque,
La vie est supportable uniquement parce que l'on ne va pas jusqu'au bout.,Emil Cioran,
La vie est trop courte pour la gaspiller à poursuivre un amour impossible.,Henri-Frédéric Amiel,
La vie est un court exil.,Platon,
La vie est un départ et la mort un retour.,Lao Tseu,
La vie est un jeu continuel de plaisir et de peine.,Emmanuel Kant,
"La vie est un mystère qu'il faut vivre, et non un problème à résoudre.",Gandhi,
"La vie est un passage, le monde est une salle de spectacles. On entre, on regarde, on sort.",Démocrite D'Abdère,
"La vie est une chose fabuleuse, étonnante, incroyable, créatrice, que l'on trivialise et banalise en la réduisant en des jeux de molécules.",Edgar Morin,
"La vie est une expérience. Plus on fait d'expériences, mieux c'est.",Ralph Waldo Emerson,
La vie est une maladie de l'esprit.,Novalis,
La vie est une succession de changements naturels. Ne résistez pas car cela ne générera que des soucis. Laissez la réalité être la réalité. Laissez faire naturellement les choses.,Lao Tseu,
"La vie est vraiment simple, mais nous insistons à la rendre compliquée.",Confucius,
"La vie est vraiment simple, mais nous insistons pour la compliquer.",Confucius,
"La vie est, à mes yeux, instinct de croissance, de durée, d'accumulation de force, de puissance : là où la volonté de puissance fait défaut, il y a déclin.",Friedrich Nietzsche,
"La vie est, en quelque sorte, un pèlerinage.",Platon,
La vie humaine commence par l'autre côté du désespoir.,Jean-Paul Sartre,
La vie inspire plus d'effroi que la mort : c'est elle qui est le grand inconnu.,Emil Cioran,
La vie n'a de prix que par le dévouement à la vérité et au bien.,Ernest Renan,
La vie n'a de valeur que par rapport à l'usage qu'on en fait.,Emmanuel Kant,
La vie n'a pas de sens. Mais nous lui donnons un sens pendant que nous existons.,Francis Bacon (philosophe),
La vie n'est bonne qu'à étudier et à enseigner les mathématiques.,Blaise Pascal,
"La vie n'est désormais plus conçue par la morale : elle veut l'illusion, elle vit d'illusion.",Friedrich Nietzsche,
La vie n'est jamais belle ; seules les images de la vie sont belles.,Arthur Schopenhauer,
La vie n'est pas un problème à résoudre mais une réalité dont il faut faire l'expérience.,Soren Kierkegaard,
La vie n'est pas un problème à résoudre mais une réalité qui doit être vécu.,Soren Kierkegaard,
La vie n'est possible que par les déficiences de notre imagination et de notre mémoire.,Emil Cioran,
"La vie n'est qu'une variété de la mort, et une variété très rare.",Friedrich Nietzsche,
La vie n'est que de l'ennui ou de la crème fouettée.,Voltaire,
La vie ne peut être comprise qu'en remontant à sa source première. Cette source est à jamais douce et sans fin.,Swami Ramdas,
La vie ne pousse bien que là où elle est heureuse.,Brice Parain,
"La vie ne se comprend que par un retour en arrière, mais on ne la vit qu'en avant.",Soren Kierkegaard,
"La vie oscille, comme un pendule, de la souffrance à l'ennui.",Arthur Schopenhauer,
"La vie passe, rapide caravane ! Arrête ta monture et cherche à être heureux.",Omar Khayyam,
La vie persiste au sein même de la destruction.,Gandhi,
"La vie privée l'a emporté sur la vie publique, l'être a remplacé le faire.",Roger-Pol Droit,
"La vie quotidienne, si elle est sans compréhension, vous poussera à passer à côté de l'amour, de la beauté, de la mort.",Jiddu Krishnamurti,
La vie réelle se porte mieux si on lui donne ses justes vacances d'irréalité.,Gaston Bachelard,
"La vie ressemble à un conte ; ce qui importe, ce n'est pas sa longueur, mais sa valeur.",Sénèque,
"La vie sans musique est tout simplement une erreur, une fatigue, un exil.",Friedrich Nietzsche,
"La vie sans poésie et la vie sans infini, c'est comme un paysage sans ciel : on y étouffe.",Henri-Frédéric Amiel,
"La vie sans religion est une vie sans principe, et une vie sans principe est comme un bateau sans gouvernail.",Gandhi,
La vie se crée dans le délire et se défait dans l'ennui.,Emil Cioran,
"La vie serait une comédie bien agréable, si l'on n'y jouait pas un rôle.",Denis Diderot,
La vie sociale consiste à détruire ce qui lui donne son arôme.,Claude Lévi-strauss,
La vie spirituelle commence à partir du moment où nous découvrons que toute la réalité de nos actes réside dans les pensées qui les produisent. ,Louis Lavelle,
"La vie tumultueuse est agréable aux grands esprits ; mais ceux qui sont médiocres n'y ont aucun plaisir, ils sont machines partout.",Blaise Pascal,
"La vie, c'est apprendre à surmonter les marées qui menacent de nous engloutir, surnager toujours.",Henri-Frédéric Amiel,
"La vie, c'est une panique dans un théâtre en feu.",Jean-Paul Sartre,
"La vie, ce n'est pas d'attendre que les orages passent, c'est d'apprendre à danser sous la pluie.",Sénèque,
"La vie, qui a en partage la tempérance, le courage, la sagesse, ou la santé, est plus agréable que celle où se trouvent l'intempérance, la lâcheté, la folie ou la maladie.",Platon,
La vie. Bien agiter avant l'usage.,Miguel De Unamuno,
"La vieillesse affaiblit tous nos sens. Le vieillard possède tout, mais il lui manque en tout quelque chose.",Démocrite D'Abdère,
"La vieillesse est le pire des maux, car elle prive l'homme de tous les plaisirs en lui en laissant l'appétit.",Giacomo Leopardi,
"La vieillesse est noble, lorsqu'elle se défend elle -même, garde ses droits, ne se vend à personne, et jusqu'au dernier souffle domine sur les siens.",Cicéron,
"La vieillesse est un état de repos quant aux sens. Lorsque la violence des passions s'est relâchée, on se voit délivré d'une foule de tyrans forcenés.",Platon,
"La vieillesse, en définitive, n'est que la punition d'avoir vécu.",Emil Cioran,
La violence : une force faible.,Vladimir Jankélévitch,
La violence de la femme est dans ses charmes.,Jean-Jacques Rousseau,
La violence est ce qui ne parle pas.,Gilles Deleuze,
La violence est injuste d'où qu'elle vienne.,Jean-Paul Sartre,
La violence et la vérité ne peuvent rien l'une sur l'autre.,Blaise Pascal,
"La violence n'est pas un moyen parmi d'autres d'atteindre la fin, mais le choix délibéré d'atteindre la fin par n'importe quel moyen.",Jean-Paul Sartre,
"La violence se donne toujours pour une contre-violence, c'est-à-dire pour une riposte à la violence de l'autre.",Jean-Paul Sartre,
"La violence, sous quelque forme qu'elle se manifeste, est un échec.",Jean-Paul Sartre,
"La voie du ciel c'est : vaincre sans lutter, convaincre sans parler, faire venir sans appeler, réaliser dans la sérénité.",Lao Tseu,
"La voie du juste milieu n'est pas suivie. Les hommes intelligents vont au-delà, les ignorants restent en deçà. Les sages veulent trop faire, et l'homme de peu pas assez. C'est ainsi que tout homme boit et mange, et peu savent juger des saveurs.",Confucius,
La voix de l'homme est bien incapable d'offrir autre chose que des perspectives terrestres.,Jean-Paul II,
La voix de la conscience et de l'honneur est bien faible quand les boyaux crient.,Denis Diderot,
La volonté de condamner emploie toujours l'arme qu'elle a sous la main.,Gaston Bachelard,
"La volonté de gagner, l'envie de réussir, l'envie d'atteindre votre plein potentiel... ce sont les clés qui vous ouvriront la porte de l'excellence personnelle.",Confucius,
La volonté de ne point douter empêche le doute.,François Hertel,
La volonté du souverain est le souverain lui-même.,Montesquieu,
La volonté est l'idée.,Arthur Schopenhauer,
"La volonté est tellement libre de sa nature, qu'elle ne peut jamais être contrainte.",René Descartes,
"La volonté est, pour tout ce qui est passé, un méchant spectateur.",Friedrich Nietzsche,
La vraie éloquence se moque de l'éloquence.,Blaise Pascal,
La vraie et unique vertu est de se haïr.,Blaise Pascal,
La vraie faute est celle qu'on ne corrige pas.,Confucius,
"La vraie gloire ne consiste ni à mourir, ni à vivre, mais à bien faire l'un et l'autre.",Denis Diderot,
"La vraie marque d'une vocation est l'impossibilité d'y forfaire, c'est-à-dire de réussir à autre chose que ce pourquoi l'on a été créé.",Ernest Renan,
La vraie morale se moque de la morale.,Blaise Pascal,
"La vraie moralité ne consiste pas à suivre les sentiers battus, mais à découvrir ce qui est pour nous-mêmes la vraie voie et à la suivre avec intrépidité. Tout véritable progrès est impossible sans une telle poursuite acharnée de la vérité.",Gandhi,
La vraie nouveauté naît toujours dans le retour aux sources.,Edgar Morin,
"La vraie pauvreté est celle de l'âme, une pauvreté dans laquelle le mental est toujours dans un tourbillon créé par les doutes, les soucis et les craintes.",Swami Ramdas,
La vraie philosophie est de voir les choses telles qu'elles sont.,Georges-Louis Leclerc De Buffon,
"La vraie poésie est plus vraie que la science, parce qu'elle est synthétique et saisit dès l'abord ce que la combinaison de toutes les sciences pourra tout au plus atteindre une fois comme résultat.",Henri-Frédéric Amiel,
La vraie politesse n'est que la confiance et l'espérance dans les hommes.,Henry David Thoreau,
"La vraie sagesse, la vraie supériorité ne se gagne pas en luttant mais en laissant les choses se faire d'elles-mêmes. Les plantes qui résistent au vent se cassent, alors que les plantes souples survivent aux ouragans.",épicure,
La vulnérabilité des choses précieuses est belle parce que la vulnérabilité est une marque d'existence.,Simone Weil,
"Laisse les racines de l'amour pousser en toi, car de ces racines ne peuvent fleurir que de bonnes choses.",Saint Augustin D'Hippone,
Larmoir : meuble servant à ranger les pleurs.,Alain Finkielkraut,
"Le ""déterminisme"" est la seule manière de se représenter le monde. Et l'indéterminisme, la seule manière d'y exister.",Paul Valéry,
Le baccalauréat est le certificat que donne l'Etat et qui atteste à tous que le jeune Untel ne sait absolument rien faire.,Paul Valéry,
"Le baiser d'un enfant, c'est l'âme de sa mère !",Soren Kierkegaard,
"Le barbare n'est pas un étranger qui parle une autre langue, la sienne, mais l'étranger qui parle ma langue et qui l'écorche.",Roger-Pol Droit,
"Le barbare, c'est d'abord celui qui croit à la barbarie.",Claude Lévi-strauss,
Le beau est ce qu'on ne peut pas vouloir changer.,Simone Weil,
Le beau est le symbole du bien moral.,Emmanuel Kant,
"Le beau est supérieur au sublime parce qu'il est permanent et ne rassasie pas ; tandis que le sublime est relatif, passager et violent.",Henri-Frédéric Amiel,
"Le beau, c'est la splendeur du vrai.",Platon,
Le besoin de croire à quelque chose d'extraordinaire est inné dans l'homme.,Ernest Renan,
"Le besoin de nouveau est signe de fatigue ou de faiblesse de l'esprit, qui demande ce qui lui manque. Car il n'est rien qui ne soit nouveau.",Paul Valéry,
Le besoin sexuel est le plus violent de nos appétits : le désir de tous nos désirs.,Arthur Schopenhauer,
Le bien et l'être sont identiques dans la réalité ; ils ne diffèrent que selon la raison.,Thomas D'Aquin,
Le bien et le mal ne sont pas des grandeurs parfaitement opposées l'une à l'autre ; le bien souvent accouche du mal et la capacité de voir le mal en face est ce qui nous ouvre la capacité d'un bien relatif.,André Glucksmann,
"Le bien ne suffit pas à assurer le bonheur, mais le mal suffit à assurer le malheur.",Aristote,
Le bien pour l'homme consiste dans une activité de l'âme en accord avec la vertu.,Aristote,
"Le bien suprême de l'âme est la connaissance de Dieu ; et la vertu suprême de l'âme, c'est connaître Dieu.",Baruch Spinoza,
Le blasphème des grands esprits est plus agréable à Dieu que la prière intéressée de l'homme vulgaire.,Ernest Renan,
"Le bon dramaturge doit posséder le sens de l'assassinat ; depuis les Elisabéthains, qui sait encore tuer ses personnages ?",Emil Cioran,
Le bon juge condamne le crime sans condamner le criminel.,Sénèque,
Le bon juge condamne le crime sans haïr le criminel.,Sénèque,
"Le bon mariage c'est l'amitié tendre, l'affection et la fidélité, le secours mutuel dans toutes les épreuves de la vie, mais il doit se garder des intempérances redoutables de la passion.",Henri-Frédéric Amiel,
"Le bon sens chez les jeunes, c'est la glace au printemps.",Georg Christoph Lichtenberg,
Le bon sens est la chose au monde la mieux partagée : car chacun pense en être bien pourvu.,René Descartes,
"Le bon sens est la denrée la plus largement partagée au monde, car tout homme est convaincu d'en être bien pourvu.",René Descartes,
Le bonheur a les yeux fermés.,Paul Valéry,
Le bonheur c'est le plaisir sans remords.,Socrate,
"Le bonheur c'est un bon compte en banque, une bonne cuisinière et une bonne digestion.",Jean-Jacques Rousseau,
Le bonheur consiste à avoir beaucoup de passions et beaucoup de moyens de les satisfaire.,Charles Fourier,
Le bonheur de l'homme est; je veux : le bonheur de la femme est; il veut.,Friedrich Nietzsche,
"Le bonheur de l'homme, en amour, se proportionne à la liberté dont jouissent les femmes.",Charles Fourier,
Le bonheur est à ceux qui se suffisent à eux-mêmes.,Aristote,
Le bonheur est bien un présent divin.,Aristote,
"Le bonheur est en même temps ce qu'il y a de meilleur, de plus beau et de plus agréable.",Aristote,
"Le bonheur est en quelque sorte, ce qui met un point d'arrêt à la fuite en avant du désir.",Paul Ricoeur,
Le bonheur est la plus cruelle des armes aux mains du temps.,Paul Valéry,
Le bonheur est la seule chose qui se double si on le partage.,Albert Schweitzer,
Le bonheur est souvent la seule chose qu'on puisse donner sans l'avoir et c'est en le donnant qu'on l'acquiert.,Voltaire,
Le bonheur est un bien que nous vend la nature.,Voltaire,
Le bonheur est un état constant et l'homme un être trop muable pour que l'un convienne à l'autre.,Jean-Jacques Rousseau,
Le bonheur est un état d'esprit qui procède de l'accomplissement de vos valeurs.,Ayn Rand,
Le bonheur est un état permanent qui ne semble pas fait ici-bas pour l'homme.,Jean-Jacques Rousseau,
Le bonheur est un idéal de l'imagination et non de la raison.,Emmanuel Kant,
Le bonheur est un mot abstrait composé de quelques idées de plaisir.,Voltaire,
Le bonheur est un parfum que l'on ne peut répandre sur autrui sans en faire rejaillir quelques gouttes sur soi-même.,Ralph Waldo Emerson,
"Le bonheur est une chose qui se vit et se sent, et non qui se raisonne et se définit.",Miguel De Unamuno,
Le bonheur est une femme.,Friedrich Nietzsche,
Le bonheur et le malheur se trouvent dans l'âme.,Démocrite D'Abdère,
"Le bonheur n'a point d'enseigne extérieure ; pour le connaître, il faudrait lire dans le coeur de l'homme heureux.",Jean-Jacques Rousseau,
"Le bonheur n'est ni hors de nous ni dans nous. Il est en Dieu, et hors et dans nous.",Blaise Pascal,
"Le bonheur n'est pas un idéal de raison, mais d'imagination.",Emmanuel Kant,
"Le bonheur n'est que dans ce qui agite, et il n'y a que le crime qui agite : la vertu, qui n'est qu'un état d'inaction et de repos, ne peut jamais conduire au bonheur.",Marquis De Sade,
Le bonheur n'était autrefois qu'une heure fortunée.,Voltaire,
"Le bonheur naît du malheur, le malheur est caché au sein du bonheur.",Lao Tseu,
"Le bonheur ne consiste pas à acquérir et à jouir, mais à ne rien désirer, car il consiste à être libre.",épictète,
"Le bonheur ne consiste pas à avoir ce que l'on veut, mais à vouloir ce que l'on a.",Confucius,
Le bonheur ne consiste pas dans la possession de troupeaux et de l'or. C'est dans l'âme qui est le siège de la béatitude.,Démocrite D'Abdère,
Le bonheur rend généreux.,Brice Parain,
"Le bonheur repose sur le malheur, le malheur couve sous le bonheur. Qui connaît leur apogée respective ?",Lao Tseu,
"Le bonheur, bien qu'un concept indéfini, est le but de tous les êtres rationnels.",Emmanuel Kant,
"Le bonheur, c'est d'être consolé ; le courage, c'est d'être résigné.",Henri-Frédéric Amiel,
"Le bonheur, c'est de continuer à désirer ce qu'on possède.",Saint Augustin D'Hippone,
"Le bonheur, c'est de continuer à désirer ce que l'on possède.",Saint Augustin D'Hippone,
"Le bonheur, quel qu'il soit, apporte air, lumière et liberté de mouvement.",Friedrich Nietzsche,
"Le but d'une encyclopédie est de rassembler les connaissances éparses sur la surface de la terre ; d'en exposer le système général aux hommes avec qui nous vivons, et de les transmettre aux hommes qui viendront après nous.",Denis Diderot,
"Le but de l'écriture, c'est de porter la vie à l'état d'une puissance non personnelle.",Gilles Deleuze,
"Le but de l'humanité, c'est de produire de grands hommes.",Ernest Renan,
"Le but de l'instruction n'est pas de faire admirer aux hommes une législation toute faite, mais de les rendre capables de l'apprécier et de la corriger.",Nicolas De Condorcet,
"Le but de la perfection est une vie libre et dégagée de toute servitude, une vie que ne peuvent entraver aucune circonstance, aucune condition.",Swami Ramdas,
"Le but de la philosophie n'est pas de savoir ce que les hommes ont pensé, mais bien qu'elle est la vérité des choses.",Thomas D'Aquin,
"Le but de la science est de prévoir et non, comme on l'a dit souvent de comprendre.",Pierre Lecomte Du Noüy,
Le but du monde est que la raison règne. L'organisation de la raison est le devoir de l'humanité.,Ernest Renan,
"Le but n'est pas le but, c'est la voie.",Lao Tseu,
Le cafard est universel. Même les poux doivent le connaître. Aucun moyen de s'en prémunir.,Emil Cioran,
Le café rend de nombreuses personnes stupides temporairement capables de sages actions.,Montesquieu,
"Le calcul que vous trouvez si mauvais est pourtant celui de toutes les passions. Des années entières de poursuite, pour la jouissance d'un moment.",Denis Diderot,
Le caractère d'un homme fait son destin.,Démocrite D'Abdère,
Le caractère naturel du Français est composé des qualités du singe et du chien couchant.,Montesquieu,
Le cerveau des poètes est un fond de mer où bien des coques reposent.,Paul Valéry,
Le charme : ce qui dans les autres nous rend plus contents de nous-mêmes.,Henri-Frédéric Amiel,
Le chat est un domestique infidèle que l'on ne garde que par nécessité.,Georges-Louis Leclerc De Buffon,
Le chat n'est pas tenu de vivre selon les lois du lion.,Baruch Spinoza,
Le châtiment déprime la moralité car il donne au crime une compensation finie.,Paul Valéry,
Le châtiment est fait pour améliorer celui qui châtie.,Friedrich Nietzsche,
"Le chef est l'image du père, le peuple est l'image des enfants, et tous étant nés égaux et libres n'aliènent leur liberté que pour leur utilité.",Jean-Jacques Rousseau,
"Le chef-d'oeuvre littéraire de la France est peut-être sa prose abstraite, dont la pareille ne se trouve nulle part.",Paul Valéry,
Le chemin de la sagesse ou de la liberté est un chemin qui mène au centre de son propre être.,Mircea Eliade,
Le chemin de vie est ce fil conducteur que nous suivons de façon consciente ou inconsciente tout le long de notre existence.,Lao Tseu,
Le chemin du sage consiste à agir. Mais pas dans l'esprit de rivaliser.,Lao Tseu,
Le chercheur de tare en trouvera même au paradis.,Henry David Thoreau,
Le cheval est la plus noble conquête que l'homme ait jamais faite.,Georges-Louis Leclerc De Buffon,
"Le chien est l'animal le plus vigilant ; pourtant, il dort toute la journée.",Georg Christoph Lichtenberg,
"Le choix en politique n'est pas entre le bien et le mal, mais entre le préférable et le détestable.",Raymond Aron,
"Le chrétien est un mauvais païen, converti par un mauvais juif.",Simone Weil,
Le Christ sera toujours un mystère pour celui croit.,Blaise Pascal,
"Le christianisme a donné du poison à boire à Eros. Il n'en est pas mort, mais il a dégénéré en vice.",Friedrich Nietzsche,
"Le christianisme et l'alcool, les deux plus grands agents de corruption.",Friedrich Nietzsche,
"Le ciel a donné aux êtres humains trois choses pour équilibrer les chances de la vie: l'espoir, le sommeil et le rire.",Emmanuel Kant,
Le ciel arme de pitié ceux qu'il ne veut pas voir détruits.,Lao Tseu,
"Le ciel dure, la terre persiste Qu'est-ce donc qui les fait persister et durer ? Ils ne vivent point pour eux-mêmes Voilà ce qui les fait durer et persister.",Lao Tseu,
Le ciel est le pain quotidien des yeux.,Ralph Waldo Emerson,
Le ciel et la terre sont en nous.,Gandhi,
Le ciel peut seul faire les dévots ; les princes font les hypocrites.,Montesquieu,
Le coeur a ses raisons que la raison ne connaît point.,Blaise Pascal,
"Le coeur humain n'a que deux ressorts, l'ambition et l'amour.",Maine De Biran,
Le coeur humain refuse de croire en un univers sans but.,Emmanuel Kant,
Le coeur le plus endurci et l'ignorance la plus crasse doivent disparaître devant le soleil levant de la souffrance patiente et sans méchanceté.,Gandhi,
"Le coeur n'apprend que par la souffrance, et je crois, que Dieu ne s'apprend que par le coeur.",Ernest Renan,
"Le coeur ne vieillit pas, mais il est pénible de loger un dieu dans des ruines.",Voltaire,
Le coeur préfère l'amour qui fait souffrir à l'indifférence qui laisse isolé.,Henri-Frédéric Amiel,
Le coeur s'attendrit plus volontiers à des maux feints qu'à des maux véritables.,Jean-Jacques Rousseau,
"Le combat est père et roi de tout. Les uns, il les produit comme des dieux, et les autres comme des hommes. Il rend les uns esclaves, les autres libres.",Héraclite D'Éphèse,
Le combat que se livrent en chaque individu le fanatique et l'imposteur est cause que nous ne savons jamais à qui nous adresser.,Emil Cioran,
"Le comble de l'orgueil, ou de l'abjection, est le comble de l'ignorance de soi-même.",Baruch Spinoza,
Le comble de la méchanceté est de haïr les gens de bien.,Plutarque,
"Le comédien, lorsqu'il a fini de travailler, redevient un homme comme les autres ; alors que l'acteur ""se joue lui-même"" à toutes les secondes.",Jean-Paul Sartre,
"Le commencement de bien vivre, c'est de bien écouter.",Plutarque,
"Le commencement de toutes les sciences, c'est l'étonnement de ce que les choses sont ce qu'elles sont.",Aristote,
Le commencement est beaucoup plus que la moitié de l'objectif.,Aristote,
Le commencement est la moitié de tout.,Pythagore,
"Le commerce du sage est sans valeur et il perfectionne ; le commerce de l'homme de peu est agréable, et il corrompt.",Confucius,
Le commerce est la chose du monde la plus utile à l'Etat.,Montesquieu,
Le communisme commence là où commence l'athéisme.,Karl Marx,
"Le communisme en tant que système s'est révélé ""un remède plus dangereux que la maladie elle-même"".",Jean-Paul II,
Le communisme n'enlève à personne le pouvoir de s'approprier des produits sociaux; il n'ôte que le pouvoir d'asservir à l'aide de cette appropriation le travail d'autrui.,Karl Marx,
"Le communisme n'est pas un état de choses qu'il convient d'établir, un idéal auquel la réalité devra se conformer. Nous appelons communisme le mouvement réel qui abolit l'état actuel des choses. Les conditions de ce mouvement résultent des données préalables telles qu'elles existent actuellement.",Karl Marx,
Le comportement borné des hommes en face de la nature conditionne leur comportement borné entre eux.,Karl Marx,
Le concret c'est de l'abstrait rendu familier par l'usage.,Paul Langevin,
"Le concret, c'est l'homme dans le monde.",Jean-Paul Sartre,
"Le concubinage, lui aussi, a été corrompu - par le mariage.",Friedrich Nietzsche,
Le consentement des hommes réunis en société est le fondement du pouvoir. Celui qui ne s'est établi que par la force ne peut subsister que par la force.,Denis Diderot,
"Le consumérisme est l'addiction aux produits inutiles, à valeur illusoire ou imaginaire, parfois toxiques.",Edgar Morin,
"Le contentement se lit dans les yeux, dans le maintien, dans l'accent, dans la démarche, et semble se communiquer à celui qui l'aperçoit.",Jean-Jacques Rousseau,
"Le contraire de la vérité est la fausseté : quand elle est tenue pour vérité, elle se nomme erreur.",Emmanuel Kant,
Le coq est roi sur son fumier.,Sénèque,
Le corps est le tombeau de l'âme.,Platon,
