citation,auteur,
"Il y a une contradiction indépassable entre les fermetures ethniques, nationalistes, religieuses et le besoin d'une conscience d'humanité commune au XXIèeme siècle.",Edgar Morin,
"Il y a une façon nerveuse, et une façon langoureuse, de faire de la politique, comme de faire l'amour. La rencontre des deux donne les plus beaux effets, ou les plus beaux enfants.",Jean Baudrillard,
Il y a une infinité de choses où le moins mal est le meilleur.,Montesquieu,
Il y a une innocence dans le mensonge qui est signe de bonne foi.,Friedrich Nietzsche,
"Il y a une limite où l'intellect échoue et tombe en panne, et cette limite est où les questions concernant Dieu et le libre arbitre et l'immortalité se posent.",Emmanuel Kant,
"Il y a, entre Londres et Paris, cette différence que Paris est fait pour l'étranger et Londres pour l'Anglais. L'Angleterre a bâti Londres pour son propre usage, la France a bâti Paris pour le monde entier.",Ralph Waldo Emerson,
"Il y en a bien qui croient mais par superstition. Il y en a bien qui ne croient pas, mais par libertinage.",Blaise Pascal,
"Ils craignent de mourir, et ils ne craignent pas de vivre !",Paul Valéry,
"Ils ne savent pas que ce n'est que la chasse, et non la prise qu'ils recherchent.",Blaise Pascal,
"Ils ont donné aux pères une grande autorité sur leurs enfants. Rien ne soulage plus les magistrats ; rien ne dégarnit plus les tribunaux ; rien, enfin, ne répand plus de tranquillité dans un état.",Montesquieu,
"Ils veulent embrasser l'Intelligence de Dieu en qui l'univers est inclus et la peser et la diviser à l'infini, comme pour l'anatomiser.",Léonard De Vinci,
"Imaginer, c'est hausser le réel d'un ton.",Gaston Bachelard,
"Immédiatement après l'auteur d'un bon mot, vient le premier qui le cite.",Ralph Waldo Emerson,
"Immortels, mortels ; mortels, immortels ; notre vie est la mort des premiers et leur vie, notre mort.",Héraclite D'Éphèse,
"Imposer sa volonté aux autres, c'est force. Se l'imposer à soi-même, c'est force supérieure.",Lao Tseu,
"Impossible de pardonner à qui nous a fait du mal, si ce mal nous abaisse. Il faut penser qu'il ne nous a pas abaissé, mais a révélé notre vrai niveau.",Simone Weil,
"Incompréhensible que Dieu soit, et incompréhensible qu'il ne soit pas.",Blaise Pascal,
Incroyable que Dieu s'unisse à nous.,Blaise Pascal,
"Insensés qui vous plaignez sans cesse de la nature, apprenez que tous vos maux vous viennent de vous.",Jean-Jacques Rousseau,
Intellectuels ? Ceux qui donnent des valeurs à ce qui n'en a point.,Paul Valéry,
"Interdire totalement la parole, c'est atrophier ou annihiler la pensée. Le tabou n'est pas qu'une interdiction de nommer. C'est une interdiction de concevoir qui, si elle est efficace, entraîne l'impossibilité de concevoir.",Edgar Morin,
"Internet est le rendez-vous des chercheurs, mais aussi celui de tous les cinglés, de tous les voyeurs et de tous les ragots de la terre.",Alain Finkielkraut,
"Interpréter consiste toujours à mettre en équivalence deux textes : celui de l'auteur, celui de l'interprète.",Tzvetan Todorov,
"Interroger, c'est enseigner.",Xénophon,
Inutile d'enseigner aux singes à grimper aux arbres.,Lao Tseu,
Inutile de le nier : la femme n'est pas pareille à l'homme.,Jean-Paul Sartre,
"Invectives, ces ultimatum de l'impuissance.",Emil Cioran,
J'admire comme on peut mentir en mettant la raison de son côté.,Jean-Paul Sartre,
"J'admire la bonté de parole et de geste envers l'humanité de la part des athées, car ils n'attendent aucune récompense de l'au-delà.",Jean D'Ormesson,
"J'ai aimé Dieu, qui n'est rien aux yeux des hommes qui ne sont rien. Je n'ai détesté ni les hommes ni les femmes. Et j'ai aimé la vie qui est beaucoup moins que rien, mais qui est tout pour nous.",Jean D'Ormesson,
"J'ai beau mourir, l'univers continue. Cela ne me console pas si je suis autre que l'univers. Mais si l'univers est à mon âme comme un autre corps, ma mort cesse d'avoir pour moi plus d'importance que celle d'un inconnu.",Simone Weil,
"J'ai besoin d'un grand calme c'est pour cela que, contrairement à beaucoup d'amis, je ne peux pas écrire au café. Je connais des gens qui écrivent des livres dans des avions, mais je n'y crois pas beaucoup. Ça ne peut [...] ► Lire la suite",Jean D'Ormesson,
J'ai besoin de me recueillir pour aimer.,Jean-Jacques Rousseau,
"J'ai conclu à l'existence évidente de Dieu, et que mon existence dépend entièrement de Dieu dans tous les moments de ma vie, que je ne pense pas que l'esprit humain puisse rien savoir avec plus d'évidence et de certitude.",René Descartes,
J'ai construit ma vie pour n'avoir rien à demander à personne.,Michel Onfray,
"J'ai cru en Toi, et je te vois sans force contre l'écume des moments. Mon coeur en est désespéré.",Paul Valéry,
J'ai décidé d'être heureux parce que c'est bon pour la santé.,Voltaire,
"J'ai divisé le traité des oiseaux en quatre livres :Le premier traite du vol par battement d'ailes (vol ramé);Le deuxième du vol par la faveur du vent (vol plané);Le troisième du vol en général des chauve souris, poissons, insectes;La quatrième du vol artificiel.",Léonard De Vinci,
"J'ai donc dû supprimer les connaissances, pour faire place à la croyance.",Emmanuel Kant,
"J'ai écrit tous ces livres, et on se souviendra de ma cravate tricot.",Jean D'Ormesson,
"J'ai été aimé des quatre femmes dont il m'importait le plus d'être aimé, ma mère, ma soeur, ma femme et ma fille.",Ernest Renan,
"J'ai eu soudain la certitude que le christianisme est par excellence la religion des esclaves, que les esclaves ne peuvent pas ne pas y adhérer, et moi parmi les autres.",Simone Weil,
"J'ai fait un peu de bien, c'est mon meilleur ouvrage.",Voltaire,
J'ai hérité à la fois du talent de ma mère pour dépenser de l'argent et du don de mon père pour ne pas en gagner.,Francis Bacon (philosophe),
"J'ai horreur des risques, et je ne puis me décider à prêter à rire au destin.",Henri-Frédéric Amiel,
J'ai la nostalgie d'une de ces vieilles routes sinueuses et inhabitées qui mènent hors des villes... une route qui conduise aux confins de la terre... où l'esprit est libre...,Henry David Thoreau,
J'ai longtemps passé pour un écrivain du bonheur.,Jean D'Ormesson,
"J'ai peine à croire qu'on parvienne un jour à démontrer que nous sommes l'oeuvre d'un être suprême et non pas, comme il semble, celle d'un être fort imparfait qui nous a fabriqués en guise de passe-temps.",Georg Christoph Lichtenberg,
J'ai pour but l'amitié avec le monde entier. Je peux unir le plus grand amour à la plus ferme opposition au mal.,Gandhi,
J'ai regardé dans le registre des maladies et n'y ai point trouvé les soucis ni les pensées tristes. Cela est fort injuste.,Georg Christoph Lichtenberg,
J'ai tant aimé la vie que j'accepte la mort comme son accomplissement.,Jean D'Ormesson,
J'ai toujours eu pour principe de ne faire jamais par autrui ce que je pouvais faire par moi-même.,Montesquieu,
"J'ai toujours pensé qu'un article devait être écrit vite, à peu près à l'allure à laquelle on le lit.",Jean D'Ormesson,
"J'ai toujours senti que l'état d'auteur n'était, ne pouvait être illustre et respectable qu'autant qu'il n'était pas un métier. Pour pouvoir, pour oser dire de grandes vérités, il ne faut pas dépendre de son succès.",Jean-Jacques Rousseau,
"J'ai toujours vu que pour réussir dans le monde, il fallait avoir l'air fou et être sage.",Montesquieu,
J'ai très tôt renoncé à la viande et un jour viendra où les hommes tels que moi proscriront le meurtre des animaux comme ils proscrivent aujourd'hui le meurtre de leurs semblables.,Léonard De Vinci,
"J'aime les paysans, ils ne sont pas assez savants pour raisonner de travers.",Montesquieu,
J'aime mieux être homme à paradoxes qu'homme à préjugés.,Jean-Jacques Rousseau,
J'aime mieux être lu plusieurs fois par un seul qu'une fois par plusieurs.,Paul Valéry,
"J'aime qu'un petit clown de courts métrages cinema muet soit devenu le génial Charlie Chaplin, j'aime que le comédien obscur d'un western-spaghetti soit devenu le grand Clint Eastwood.",Edgar Morin,
"J'aime ton amour, et je désire ton désir.",Emil Cioran,
J'appelle absolu tout ce qui contient en soi la nature pure et simple que l'on cherche.,René Descartes,
"J'appelle éducation positive ce qui tend à former l'esprit avant l'âge, et à donner à l'enfant la connaissance des devoirs de l'homme.",Jean-Jacques Rousseau,
"J'appelle intérêts civils, la vie, la liberté, la santé du corps ; la possession des biens extérieurs, tels que sont l'argent, les terres, les maisons, les meubles, et autres choses de cette nature.",John Locke,
"J'appelle préjugé, non pas ce qui fait qu'on ignore de certaines choses, mais ce qui fait qu'on s'ignore soi-même.",Montesquieu,
J'appelle techniciens ceux qui se trompent selon les règles.,Paul Valéry,
J'approche tout doucement du moment où les philosophes et les imbéciles ont la même destinée.,Voltaire,
J'aurais aimé les hommes en dépit d'eux-mêmes.,Jean-Jacques Rousseau,
"J'écris particulièrement du milan parce que c'est mon destin. Au plus lointain souvenir de mon enfance, je me souviens qu'étant au berceau, un milan vient à moi et m'ouvrit la bouche avec sa queue, et plusieurs fois me frappa ainsi de sa queue entre les lèvres.",Léonard De Vinci,
"J'emportais souvent, dans mes voyages, un de ces volumes de la « Pléiade » qui vous permettent de transporter toute une bibliothèque sur papier bible dans un format assez restreint. Et je choisissais Proust une fois sur deux ou trois",Jean D'Ormesson,
J'entends et j'oublie. Je vois et je me souviens. Je fais et je comprends.,Confucius,
J'espère ne pas mourir le même jour qu'un rocker !,Jean D'Ormesson,
J'espère qu'un jour on jugera de ce que je fus par ce que j'ai su souffrir.,Jean-Jacques Rousseau,
J'espère voir le jour où la loi garantira une liberté civile égale à tous les habitants du même empire.,Alexis De Tocqueville,
J'étais convaincu que nos croyances reposent bien plus sur la coutume et l'exemple que sur une certaine connaissance.,René Descartes,
J'exècre cette vie que j'idôlatre.,Emil Cioran,
J'ignore ce que sont les heures de félicité que l'amant goûte avec la bien-aimée avant le mariage ; mais les heures d'enivrement qu'elle connaît dans un magasin de couture lui passent sous le nez.,Soren Kierkegaard,
"J'ignore tout de la vie, que saurais-je de la mort ?",Confucius,
J'ose croire n'être fait comme aucun de ceux qui existent.,Jean-Jacques Rousseau,
"Jadis il fallait craindre de mourir dans le déshonneur, ou dans le péché. Aujourd'hui, il faut craindre de mourir idiot.",Jean Baudrillard,
"Jadis le moi se cachait dans le troupeau ; à présent, le troupeau se cache encore au fond du moi.",Friedrich Nietzsche,
"Jailli du néant, le monde, plongé dans le temps, est, dès son origine, un retour au néant.",Jean D'Ormesson,
Jamais encore la vérité ne s'est accrochée au bras d'un intransigeant.,Friedrich Nietzsche,
Jamais l'imitation n'a rien créé.,Georges-Louis Leclerc De Buffon,
Jamais l'objet d'un poète n'est et ne peut être de nous apprendre qu'il pleut.,Paul Valéry,
"Jamais la loi n'a rendu les hommes plus justes d'une seule once, mais, en raison du respect qu'ils lui portent.",Henry David Thoreau,
"Jamais la nature n'est si avilie, que quand l'ignorance superstitieuse est armée du pouvoir.",Voltaire,
Jamais la nature ne nous trompe ; c'est toujours nous qui nous trompons.,Jean-Jacques Rousseau,
Jamais le sage ne se met en colère.,Cicéron,
Jamais le soleil ne voit l'ombre.,Léonard De Vinci,
Jamais les hommes n'ont eu autant de motifs de ne plus s'entre-tuer.,Raymond Aron,
Jamais les hommes ne font le bien que par nécessité.,Machiavel,
"Jamais les philosophes ne feront une secte de religion. Pourquoi ? C'est qu'il n'écrivent point pour le peuple, et qu'il sont sans enthousiasme.",Voltaire,
Jamais on n'aimera celui qu'on a mis en nourrice comme celui qu'on a nourri sous ses yeux.,Jean-Jacques Rousseau,
"Jamais on ne corrompt le peuple, mais souvent on le trompe.",Jean-Jacques Rousseau,
Jamais on ne fait le mal si pleinement et si gaiement que quand on le fait par conscience.,Blaise Pascal,
Jamais passion ne fut plus justifiée par la raison que la mienne.,Denis Diderot,
Janvier est le mois où l'on offre ses meilleurs voeux à ses amis. Les autres mois sont ceux où ils ne se réaliseront pas.,Georg Christoph Lichtenberg,
Je compterais plus sur le rôle d'un homme espérant une grande récompense que sur celui d'un homme l'ayant reçue.,Voltaire,
Je compterais plus sur le rôle d&#039;un homme espérant une grande récompense que sur celui d&#039;un homme l&#039;ayant reçue. ,Voltaire,
Je compterais plus sur le zèle d'un homme espérant une grande récompense que sur celui d'un homme l'ayant reçue.,Voltaire,
"Je connais le chemin : il est étroit, comme le fil d'une épée. Je me réjouis si je parviens à le suivre. Je pleure si j'en dévie. Car Dieu nous dit : ""Seul celui qui essaie de suivre le chemin ne périra jamais""...",Gandhi,
"Je connais trop les hommes pour ignorer que souvent l'offensé pardonne, mais que l'offenseur ne pardonne jamais.",Jean-Jacques Rousseau,
Je crains l'homme d'un seul livre.,Thomas D'Aquin,
Je crains que notre éducation trop soigneuse ne donne que des fruits nains.,Georg Christoph Lichtenberg,
Je croirais plutôt toutes les fables des légendes et le Talmud et le Coran que cette création universelle n'ait pas de créateur.,Francis Bacon (philosophe),
Je crois au génie du peuple tant que les médias de masse ne l'abrutissent pas pour le transformer en masse abêtie.,Michel Onfray,
"Je crois au salut de l'humanité, à l'avenir du cyanure...",Emil Cioran,
"Je crois en définitive, que l'homme est un être si libre que l'on ne peut lui contester le droit d'être ce qu'il croit qu'il est.",Georg Christoph Lichtenberg,
"Je crois fondamentalement, vraiment fondamentalement à l'égalité des gens. Je crois à l'égalité. Je me demande parfois s'il y a des gens plus intelligents que d'autres, je n'en suis pas sûr, je pense qu'il y a des gens qui ont [...] ► Lire la suite",Jean D'Ormesson,
Je crois qu'il y a des résistances honnêtes et des rébellions légitimes.,Alexis De Tocqueville,
"Je crois qu'on ne peut mieux vivre qu'en cherchant à devenir meilleur, ni plus agréablement qu'en ayant la pleine conscience de son amélioration.",Socrate,
"Je crois que l'évolution spirituelle implique, à un certain moment, d'arrêter de tuer les êtres vivants que sont les animaux, simplement pour satisfaire nos désirs physiques.",Gandhi,
"Je crois que les mauvais philosophes peuvent avoir une certaine influence, les bons jamais.",Bertrand Russell,
Je crois que nous avons plus d'idées que de mots ; combien de choses senties qui ne sont pas nommées !,Denis Diderot,
"Je crois que philosopher, c'est anticiper.",Michel Serres,
"Je crois que si je passe pour l'écrivain du bonheur, c'est parce que je pense qu'il faut être heureux en dépit de tout le reste.",Jean D'Ormesson,
"Je crois, toutes réflexions faites, qu'il ne faut jamais penser à la mort ; cette pensée n'est bonne qu'à empoisonner la vie ; la grande affaire est de ne point souffrir.",Voltaire,
"Je déteste le nationalisme. Je crois, au plus profond de moi, que la construction européenne doit nous débarrasser de ce mixte bizarre de maurrassisme et de jacobinisme qui fait le fond de sauce de notre religion patriote. Je trouve que La Marseillaise, par exemple, est un chant détestable et grotesque.",Bernard-Henri Lévy,
Je déteste les âmes étroites : il n'y a là rien de bon et presque rien de mauvais.,Friedrich Nietzsche,
Je déteste voir les acteurs si contents d'eux-mêmes quand ils saluent. Ca détruit toutes les illusions qu'ils ont créées pendant la représentation.,Alain De Botton,
Je donnerais tous les paysages du monde pour celui de mon enfance.,Emil Cioran,
"Je fais bien de ne pas rendre l´accès à mon coeur facile; quand on y est une fois entré, on en sort pas sans le déchirer, c´est une plaie qui ne cautérise jamais bien.",Denis Diderot,
Je fais cas d'un philosophe dans la mesure où il est capable de fournir un exemple.,Friedrich Nietzsche,
Je ferai le Bien : c'est encore la meilleure manière d'être seul.,Jean-Paul Sartre,
Je gouvernerai ma vie et mes pensées comme si le monde entier devait être le témoin de l'une et pouvait lire dans les autres.,Sénèque,
Je haïs les livres ; ils n'apprennent qu'à parler de ce qu'on ne sait pas.,Jean-Jacques Rousseau,
"Je joue avec la vie, madame ; elle n'est bonne qu'à cela.",Voltaire,
Je m'arrêterais de mourir s'il me venait un bon mot.,Voltaire,
Je m'émeus du spectacle de la dégradation de l'homme par l'homme.,Alexis De Tocqueville,
"Je m'endormis, et à mon réveil trouvais que ma difficulté avait beaucoup perdu de sa violence.",Saint Augustin D'Hippone,
"Je m'oppose à la violence parce que lorsqu'elle semble produire le bien, le bien qui en résulte n'est que transitoire, tandis que le mal produit est permanent.",Gandhi,
Je me dis encore souvent : jamais je n'y arriverai.,Jean D'Ormesson,
"Je me moque du diable ! Il reçoit les âmes, mais ce n'est pas lui qui les damne.",Jean-Paul Sartre,
"Je me suis rarement perdu de vue ; je me suis détesté, je me suis adoré ; puis, nous avons vieilli ensemble.",Paul Valéry,
"Je me suis rendu compte que j'avais de moins en moins de choses à dire, jusqu'au moment où, finalement, je me suis tu. Dans le silence, j'ai découvert la voix de Dieu.",Soren Kierkegaard,
"Je meurs en adorant dieu, en aimant mes amis, en ne détestant pas mes ennemis, en haissant la superstition.",Voltaire,
"Je n'admettrai point qu'un acte injuste, attentatoire aux droits sacrés de l'humanité, puisse se justifier par une raison d'utilité.",Alexis De Tocqueville,
Je n'ai fait cette lettre-ci plus longue que parce que je n'ai pas eu le loisir de la faire plus courte.,Blaise Pascal,
Je n'ai jamais eu de chagrin qu'une heure de lecture n'ait dissipé.,Montesquieu,
Je n'ai jamais vu quelqu'un qui aimât la vertu autant que le sexe.,Confucius,
"Je n'ai pas d'ordinateur. Je ne méprise pas du tout l'informatique, tous mes amis écrivent à l'ordinateur, mais moi j'écris mes articles avec un stylo et mes livres avec un crayon. C'est la seule névrose que j'ai : je ne dois pas perdre mon crayon. Je sais qu'un livre, c'est quatre crayons.",Jean D'Ormesson,
Je n'ai pas encore vu un homme qui aimât la vertu autant qu'on aime une belle apparence.,Confucius,
Je n'ai pas encore vu un homme qui ait pu apercevoir ses défauts et qui s'en soit blâmé intérieurement.,Confucius,
Je n'ai pas été fâché de passer pour distrait: cela m'a fait hasarder bien des négligences qui m'auraient embarrassées.,Montesquieu,
Je n'ai pas la science infuse. J'aime l'Antiquité et j'ai la passion de m'informer.,Confucius,
"Je n'aime pas le mot tolérance, mais je n'en trouve pas de meilleur.",Gandhi,
"Je n'aime point Dieu parce que je ne le connais pas, ni le prochain parce que je le connais.",Montesquieu,
Je n'aime que ma patrie ; je ne crains que les dieux ; je n'espère que la vertu.,Montesquieu,
"Je n'appelle pas innocent celui qui est incapable de pêcher, mais bien celui qui ne peut pécher sans remords.",Giacomo Leopardi,
"Je ne cherche pas à connaître les réponses, je cherche à comprendre les questions.",Confucius,
"Je ne comprends pas aujourd'hui comment j'eus la bêtise de lui répondre et de me fâcher, au lieu de lui rire au nez pour toute réponse.",Jean-Jacques Rousseau,
Je ne connais de sérieux ici-bas que la culture de la vigne.,Voltaire,
Je ne connais qu'une Eglise : c'est la société des hommes.,Jean-Paul Sartre,
Je ne crois pas avoir raté une seule occasion d'être triste.,Emil Cioran,
Je ne crois pas qu'à aucune époque l'esclavage ait été utile à la vie et au bien-être social.,Alexis De Tocqueville,
Je ne crois que les témoins qui sont prêts à se faire égorger.,Blaise Pascal,
"Je ne dis pas ça par démagogie. Mais dès que vous êtes trop riche, vous êtes vulgaire.",Jean D'Ormesson,
Je ne fais pas de l'argent l'horizon indépassable de toute éthique et de toute politique.,Michel Onfray,
"Je ne m'adresse qu'à des gens capables de m'entendre, et ceux-là me liront sans danger.",Marquis De Sade,
Je ne m'attache pas obstinément à mon propre sens.,Thomas D'Aquin,
"Je ne peux pas supporter le Marquis de Sade. Je hais ses écrits. Pour autant, je détesterais qu'on le censure",Elisabeth Badinter,
Je ne peux rien pour qui ne se pose pas de questions.,Confucius,
Je ne puis apprendre à parler à qui ne s'efforce pas de parler.,Confucius,
"Je ne puis me persuader que, pour avoir raison, on soit indispensablement obligé de parler le dernier...",Jean-Jacques Rousseau,
"Je ne sais ce que c'est des principes, sinon des règles qu'on prescrit aux autres pour soi.",Denis Diderot,
"Je ne sais pas ce qu'est la conscience d'un sot, mais celle d'un homme d'esprit est pleine de sottises.",Paul Valéry,
"Je ne sais point apprendre à vivre, à qui ne songe qu'à s'empêcher de mourir.",Jean-Jacques Rousseau,
"Je ne sais rien de plus fou, et cependant de plus vulgaire, que de vouloir avoir raison.",Paul Valéry,
"Je ne sais si la soumission est en marche, mais la peur est là et, malgré les crayons brandis, malgré les professions de foi martiales, il y aura de moins en moins de « Charlie » sur notre sol.",Alain Finkielkraut,
"Je ne saurais voir dans l'athéisme un résultat, un événement : il est chez moi instinct naturel.",Friedrich Nietzsche,
"Je ne suis ni Athénien, ni Grec, mais un citoyen du monde.",Socrate,
"Je ne suis pas d'accord avec ce que vous dites, mais je me battrai jusqu'au bout pour que vous puissiez le dire.",Voltaire,
Je ne suis pas toujours de mon avis.,Paul Valéry,
"Je ne suis pas un homme, je ne suis rien. Il n'y a que Dieu. L'homme, c'est une illusion d'optique.",Jean-Paul Sartre,
"Je ne veux ni ne rejette rien absolument, mais je consulte toujours les circonstances.",Confucius,
"Je ne veux pas que ma maison soit murée de toutes parts, ni mes fenêtres bouchées, mais qu'y circule librement la brise que m'apportent les cultures de tous les pays.",Gandhi,
Je ne vois point d'autre mesure d'une connaissance que la puissance réelle qu'elle confère. Je ne sais que ce que je sais faire.,Paul Valéry,
Je ne voudrais pas perdre ma raison. Mais il y a tant de vulgarité à la garder !,Emil Cioran,
Je pense qu'avant de présenter la démocratie comme solution il faut la présenter comme problème.,Edgar Morin,
"Je pense qu'il faut respecter les hommes, pas les idées.",Elisabeth Badinter,
"Je pense, donc je suis.",René Descartes,
"Je pense, et cela me rend pensif.",Paul Valéry,
Je perds mes dents. Je meurs en détail.,Voltaire,
"Je peux douter de tout, sauf d'une chose, et c'est le fait même que je doute. Autrement dit - je pense, donc je suis.",René Descartes,
Je plains l'homme accablé du poids de son loisir.,Voltaire,
Je préfère le désespoir à l'incertitude.,Jean-Paul Sartre,
Je préfère les girondins fédéralistes et provinciaux aux jacobins centralisateurs et coupeurs de têtes.,Michel Onfray,
Je préfère modérer mes joies que réprimer mes douleurs.,Sénèque,
Je préfère un croyant intelligent à un athée imbécile.,Michel Onfray,
"Je préférerai toujours les choses aux mots, et la pensée à la rime.",Voltaire,
Je préférerais m'asseoir sur un potiron et le posséder bien à moi que d'être à plusieurs sur un coussin de velours.,Henry David Thoreau,
"Je prends acte, pour l'autre vie, de ma conduite en celle-ci.",Jean-Jacques Rousseau,
Je prends beaucoup plus de plaisir à m'instruire moi-même que non pas à mettre par écrit le peu que je sais.,René Descartes,
Je puis m'imaginer une époque où nos idées religieuses paraîtront tout aussi singulières que l'est pour nous l'esprit chevaleresque.,Georg Christoph Lichtenberg,
"Je puis tout pardonner aux hommes, excepté l'injustice, l'ingratitude et l'inhumanité.",Denis Diderot,
Je sais et je sens que faire du bien est le plus vrai bonheur que le coeur humain puisse goûter.,Jean-Jacques Rousseau,
"je sais que j'existe ; la question est, quel est ce 'je' que 'je' connais.",René Descartes,
Je sens que je suis libre mais je sais que je ne le suis pas.,Emil Cioran,
Je suis comme les petits ruisseaux ; ils sont transparents parce qu'ils sont peu profonds.,Voltaire,
Je suis comme un milieu entre Dieu et le néant.,René Descartes,
"Je suis convaincu que la philosophie n'existe au contraire que dans le détail, les singularités infimes, les tout petits faits.",Roger-Pol Droit,
Je suis corps tout entier et rien d'autre ; l'âme n'est qu'un mot désignant une parcelle du corps.,Friedrich Nietzsche,
"Je suis d'un tempérament optimiste et l'admiration m'a beaucoup porté. J'ai surtout admiré les écrivains : Yourcenar, Gracq, Aragon par-dessus tout.",Jean D'Ormesson,
Je suis de ceux qui adorent adorer.,Edgar Morin,
Je suis de plus en plus convaincu que transformation personnelle et transformation sociale ne peuvent qu'aller ensemble,Edgar Morin,
"Je suis devenu un conservateur révolutionnaire. Il faut tout révolutionner, mais en conservant les trésors de notre culture.",Edgar Morin,
Je suis distrait. Je n'ai de mémoire que dans le coeur.,Montesquieu,
Je suis enquêteur par penchant. Je ressens une grande soif de connaissance.,Emmanuel Kant,
Je suis esclave par mes vices et libre par mes remords.,Jean-Jacques Rousseau,
"Je suis honnête homme, n'ayant jamais assassiné, jamais volé ni violé, que dans mon imagination. Je ne serais pas honnête homme sans ces crimes.",Paul Valéry,
"Je suis l'enfant naturel d'un couple diabolique, le fascisme et le stalinisme.",Bernard-Henri Lévy,
